{
  "$schema": "http://json-schema.org/draft-07/schema#",
  "title": "Revenue OS extension module manifest",
  "description": "Declarative registration for a pluggable Revenue OS module. Contains no executable code; see extensions/README.md.",
  "type": "object",
  "required": ["id", "name", "description", "category", "defaultEnabled", "navLinks", "docsUrl"],
  "additionalProperties": false,
  "properties": {
    "today": {
      "type": "object",
      "required": ["source", "href"],
      "additionalProperties": false,
      "properties": {
        "source": {
          "enum": ["collection_case", "radar_opportunity"]
        },
        "href": {
          "type": "string",
          "pattern": "^/admin/[a-z0-9/-]+$"
        }
      }
    },
    "$schema": {
      "type": "string"
    },
    "id": {
      "type": "string",
      "pattern": "^[a-z][a-z0-9-]{2,48}$",
      "description": "Stable unique module key. Must not collide with a core module id."
    },
    "name": {
      "type": "string",
      "minLength": 1,
      "maxLength": 60
    },
    "description": {
      "type": "string",
      "minLength": 1,
      "maxLength": 400
    },
    "category": {
      "enum": ["revenue", "delivery", "intelligence", "sources", "system"]
    },
    "defaultEnabled": {
      "type": "boolean"
    },
    "navLinks": {
      "type": "array",
      "maxItems": 8,
      "items": {
        "type": "object",
        "required": ["id", "label", "href", "icon", "description"],
        "additionalProperties": false,
        "properties": {
          "id": {
            "type": "string",
            "pattern": "^[a-z][a-z0-9-]{1,48}$"
          },
          "label": {
            "type": "string",
            "minLength": 1,
            "maxLength": 32
          },
          "href": {
            "type": "string",
            "pattern": "^/admin/[a-z0-9-/\\[\\]]*$"
          },
          "icon": {
            "type": "string"
          },
          "description": {
            "type": "string",
            "minLength": 1,
            "maxLength": 120
          },
          "keywords": {
            "type": "string",
            "maxLength": 200
          },
          "moreGroup": {
            "enum": ["Revenue", "Delivery", "Intelligence", "System", "Sources"]
          }
        }
      }
    },
    "routes": {
      "type": "array",
      "items": {
        "type": "string",
        "pattern": "^/admin/[a-z0-9-/\\[\\]]*$"
      }
    },
    "aiToolNames": {
      "type": "array",
      "items": {
        "type": "string",
        "pattern": "^[a-z][a-z0-9_]{2,60}$"
      }
    },
    "setupChecks": {
      "type": "array",
      "items": {
        "type": "string",
        "pattern": "^[a-z][a-z0-9_]{2,60}$"
      }
    },
    "docsUrl": {
      "type": "string",
      "description": "Public documentation. Site-relative /docs/... paths or absolute http(s) URLs.",
      "anyOf": [
        {
          "type": "string",
          "pattern": "^/docs/[a-z0-9][a-z0-9/-]*$"
        },
        {
          "type": "string",
          "pattern": "^https://.+"
        }
      ]
    },
    "settings": {
      "type": "array",
      "maxItems": 12,
      "description": "Configurable values rendered by the shared ModuleSettingsForm. Never secrets: tenants.config, where values are stored, reaches client components, so a secret-shaped key or label is rejected at build time regardless of what this schema alone permits.",
      "items": {
        "type": "object",
        "required": ["key", "label", "type"],
        "additionalProperties": false,
        "properties": {
          "key": {
            "type": "string",
            "pattern": "^(?!.*(secret|token|password|api[_-]?key|credential))[a-z][a-zA-Z0-9]{1,48}$"
          },
          "label": {
            "type": "string",
            "minLength": 1,
            "maxLength": 60
          },
          "description": {
            "type": "string",
            "maxLength": 200
          },
          "type": {
            "enum": ["string", "number", "boolean", "enum", "url"]
          },
          "options": {
            "type": "array",
            "items": {
              "type": "string"
            },
            "maxItems": 20
          },
          "default": {
            "type": ["string", "number", "boolean"]
          },
          "min": {
            "type": "number"
          },
          "max": {
            "type": "number"
          }
        }
      }
    },
    "report": {
      "type": "object",
      "additionalProperties": false,
      "required": ["version", "sources"],
      "properties": {
        "version": {
          "const": 1
        },
        "sources": {
          "type": "array",
          "minItems": 1,
          "maxItems": 3,
          "items": {
            "type": "object",
            "additionalProperties": false,
            "required": ["name", "type", "columns"],
            "properties": {
              "name": {
                "type": "string",
                "pattern": "^[a-z][a-z0-9_]{0,31}$"
              },
              "type": {
                "type": "string",
                "pattern": "^[a-z][a-z0-9_]{0,63}$"
              },
              "columns": {
                "type": "array",
                "minItems": 1,
                "maxItems": 16,
                "uniqueItems": true,
                "items": {
                  "type": "string",
                  "pattern": "^[a-z_][a-z0-9_]{0,62}$"
                }
              }
            }
          }
        }
      }
    },
    "workflow": {
      "type": "object",
      "additionalProperties": false,
      "required": [
        "version",
        "inputSchema",
        "actions",
        "sources",
        "inputContract",
        "policy",
        "contractHash",
        "tools"
      ],
      "properties": {
        "version": {
          "const": 1
        },
        "inputSchema": {
          "type": "object"
        },
        "actions": {
          "type": "array",
          "minItems": 1,
          "maxItems": 3,
          "items": {
            "enum": ["create_stripe_invoice_draft", "create_task_batch"]
          }
        },
        "sources": {
          "type": "array",
          "minItems": 0,
          "maxItems": 3,
          "items": {
            "type": "object",
            "required": ["name", "type", "columns", "inputKey"],
            "additionalProperties": false,
            "properties": {
              "name": {
                "type": "string"
              },
              "type": {
                "type": "string"
              },
              "inputKey": {
                "type": "string"
              },
              "columns": {
                "type": "array",
                "items": {
                  "type": "string"
                }
              }
            }
          }
        },
        "inputContract": {
          "type": "string",
          "description": "Registered host validator; inputSchema and actions are generated from this contract."
        },
        "policy": {
          "type": "object",
          "description": "Generated host policy; exact equality is enforced by build:extensions --check."
        },
        "contractHash": {
          "type": "string",
          "pattern": "^[a-f0-9]{64}$"
        },
        "tools": {
          "type": "array",
          "minItems": 2,
          "maxItems": 5,
          "items": {
            "type": "object"
          },
          "description": "Generated tool grants; exact host registration equality enforced by build:extensions --check."
        }
      }
    },
    "settingsContract": {
      "type": "string",
      "description": "Trusted settings validator and generated field registration."
    },
    "historyRoute": {
      "type": "string",
      "pattern": "^/admin/[a-z0-9-]+(?:/[a-z0-9-]+)*$",
      "description": "Optional exact retained-record page allowed to render while disabled. This never grants API or mutation permission."
    },
    "upstream": {
      "type": "object",
      "additionalProperties": false,
      "required": ["repository", "license", "revision", "connector", "deploymentGuide"],
      "properties": {
        "repository": {
          "type": "string",
          "pattern": "^https://"
        },
        "license": {
          "type": "string",
          "minLength": 1
        },
        "revision": {
          "type": "string",
          "pattern": "^[a-f0-9]{40}$"
        },
        "imageDigest": {
          "type": "string",
          "pattern": "^sha256:[a-f0-9]{64}$"
        },
        "connector": {
          "type": "string",
          "pattern": "^[a-z][a-z0-9-]+$"
        },
        "deploymentGuide": {
          "type": "string",
          "pattern": "^plugins/[a-z0-9-]+/[^.].*\\.md$"
        }
      }
    },
    "knowledge": {
      "type": "object",
      "additionalProperties": false,
      "required": [
        "version",
        "sourceNames",
        "guidanceTypes",
        "signalTypes",
        "prerequisites",
        "success",
        "evaluations"
      ],
      "properties": {
        "version": {
          "const": 1
        },
        "sourceNames": {
          "type": "array",
          "maxItems": 3,
          "uniqueItems": true,
          "items": {
            "type": "string",
            "pattern": "^[a-z][a-z0-9_]{0,31}$"
          }
        },
        "guidanceTypes": {
          "type": "array",
          "maxItems": 6,
          "uniqueItems": true,
          "items": {
            "enum": [
              "positioning_policy",
              "workflow_preference",
              "offering",
              "messaging",
              "process_rule",
              "other"
            ]
          }
        },
        "signalTypes": {
          "type": "array",
          "maxItems": 6,
          "uniqueItems": true,
          "items": {
            "enum": [
              "draft_edit",
              "rejection",
              "explicit_correction",
              "tool_failure",
              "missing_source",
              "verified_outcome"
            ]
          }
        },
        "prerequisites": {
          "type": "array",
          "maxItems": 10,
          "items": {
            "type": "string",
            "minLength": 1,
            "maxLength": 200
          }
        },
        "success": {
          "type": "object",
          "additionalProperties": false,
          "required": ["artifact", "description"],
          "properties": {
            "artifact": {
              "enum": ["report", "action", "task"]
            },
            "description": {
              "type": "string",
              "minLength": 1,
              "maxLength": 500
            }
          }
        },
        "evaluations": {
          "type": "array",
          "maxItems": 10,
          "items": {
            "type": "object",
            "additionalProperties": false,
            "required": ["name", "scenario", "expectedArtifact"],
            "properties": {
              "name": {
                "type": "string",
                "minLength": 1,
                "maxLength": 100
              },
              "scenario": {
                "type": "string",
                "minLength": 1,
                "maxLength": 500
              },
              "expectedArtifact": {
                "enum": ["report", "action", "task", "refusal"]
              }
            }
          }
        }
      }
    }
  }
}
