{
  "$schema": "./module-manifest.schema.json",
  "id": "site-studio",
  "name": "Site Studio",
  "description": "Create, clone and edit website pages with AI or manual controls, preview them, and publish versioned revisions with rollback. Arbitrary code is never accepted.",
  "category": "delivery",
  "defaultEnabled": true,
  "navLinks": [
    {
      "id": "site-studio",
      "label": "Website & pages",
      "href": "/admin/site",
      "icon": "Globe2",
      "description": "Create page drafts, preview revisions and publish your website",
      "moreGroup": "Delivery"
    }
  ],
  "routes": ["/admin/site"],
  "aiToolNames": [
    "read_site_editor",
    "prepare_site_change",
    "stage_site_change",
    "execute_site_change",
    "suggest_site_page"
  ],
  "setupChecks": [],
  "docsUrl": "/docs/plugins/site-studio",
  "settings": []
}
