{
  "$schema": "./module-manifest.schema.json",
  "id": "opportunity-radar",
  "name": "Opportunity Radar",
  "description": "Keep versioned sources, reviewed growth opportunities and drafts, with bounded AI source briefing. Automated discovery, outreach and publication are not yet available.",
  "category": "intelligence",
  "defaultEnabled": false,
  "navLinks": [],
  "routes": [],
  "aiToolNames": [
    "prepare_radar_brief",
    "get_radar_model_status",
    "reconcile_radar_model_call",
    "get_radar_store",
    "preview_radar_store_change",
    "propose_radar_store_change",
    "get_radar_selection",
    "preview_radar_assessment",
    "propose_radar_assessment"
  ],
  "setupChecks": [],
  "settingsContract": "opportunity-radar-profile-v1",
  "settings": [
    {
      "key": "organization",
      "label": "Organization",
      "description": "Your public business or project name.",
      "type": "string",
      "default": ""
    },
    {
      "key": "website",
      "label": "Website",
      "description": "Your public HTTPS website. This setting does not authorize fetching URLs.",
      "type": "url",
      "default": ""
    },
    {
      "key": "spokesperson",
      "label": "Spokesperson",
      "description": "Optional public representative; leave blank for organization-only work.",
      "type": "string",
      "default": ""
    },
    {
      "key": "mission",
      "label": "Mission and offer",
      "description": "What you do and the useful contribution you can make.",
      "type": "string",
      "default": ""
    },
    {
      "key": "expertise",
      "label": "Earned expertise",
      "description": "Firsthand experience you can substantiate; do not enter unsupported credentials.",
      "type": "string",
      "default": ""
    },
    {
      "key": "audiences",
      "label": "Business audiences",
      "description": "The customers, professional communities or institutions you serve.",
      "type": "string",
      "default": ""
    },
    {
      "key": "topics",
      "label": "Topics",
      "description": "Business topics to watch. Public affairs requires separate neutral review, not growth scoring.",
      "type": "string",
      "default": ""
    },
    {
      "key": "ownedAssets",
      "label": "Public assets",
      "description": "Public URLs/descriptions, one per line. These are owned resources, not independent coverage.",
      "type": "string",
      "default": ""
    },
    {
      "key": "region",
      "label": "Region",
      "description": "Geographic focus, or leave blank for no regional restriction.",
      "type": "string",
      "default": ""
    },
    {
      "key": "timeZone",
      "label": "Time zone",
      "description": "IANA time zone, such as America/Chicago. Scheduling is not active in this foundation.",
      "type": "string",
      "default": "UTC"
    },
    {
      "key": "dailyShortlist",
      "label": "Daily shortlist limit",
      "description": "Maximum recommendations for future daily selection.",
      "type": "number",
      "min": 1,
      "max": 10,
      "default": 5
    },
    {
      "key": "maxDiscoveries",
      "label": "Daily discovery limit",
      "description": "Future worker cap; this does not start discovery.",
      "type": "number",
      "min": 1,
      "max": 500,
      "default": 50
    },
    {
      "key": "dailyModelBudgetUsd",
      "label": "Daily model budget (USD)",
      "description": "Zero disables automatic model spending. Model jobs must reserve the budget before calls.",
      "type": "number",
      "min": 0,
      "max": 100,
      "default": 0
    },
    {
      "key": "modelMode",
      "label": "Model spending mode",
      "type": "enum",
      "options": ["off", "free-only", "budgeted-low-cost"],
      "default": "off",
      "description": "Applies to source briefing jobs. Off makes no model calls; free-only must never fall back to paid models."
    },
    {
      "key": "preferredModel",
      "label": "Preferred registered model",
      "type": "string",
      "default": "",
      "description": "Explicit model ID from the shared evaluated model registry. OpenRouter is the current transport; no premium default or invented model IDs."
    },
    {
      "key": "maxModelCallsPerDay",
      "label": "Daily model call limit",
      "type": "number",
      "min": 0,
      "max": 20,
      "default": 0,
      "description": "Independent call cap, including free models and retries. Zero disables automatic model calls."
    },
    {
      "key": "maxInputTokensPerCall",
      "label": "Input token limit per call",
      "type": "number",
      "min": 1024,
      "max": 16000,
      "default": 8000,
      "description": "Bound retrieved evidence before a model request."
    },
    {
      "key": "maxOutputTokensPerCall",
      "label": "Output token limit per call",
      "type": "number",
      "min": 256,
      "max": 4000,
      "default": 1000,
      "description": "Short structured results; no unbounded drafting loops."
    },
    {
      "key": "maxCostPerRunUsd",
      "label": "Maximum cost per run (USD)",
      "type": "number",
      "min": 0,
      "max": 1,
      "default": 0,
      "description": "Model jobs reserve worst-case cost before requests; zero allows no paid request."
    },
    {
      "key": "sourceMode",
      "label": "Source mode",
      "type": "enum",
      "options": ["free-first"],
      "default": "free-first",
      "description": "No paid-source activation. Available public sources still have usage limits."
    },
    {
      "key": "outreachMode",
      "label": "Outreach mode",
      "type": "enum",
      "options": ["draft-only"],
      "default": "draft-only",
      "description": "No sending or publication is enabled by setup."
    }
  ],
  "docsUrl": "https://github.com/JohnConnorCode/accelerate-site/blob/main/plugins/opportunity-radar/README.md"
}
