{
  "$schema": "./module-manifest.schema.json",
  "id": "example-inventory",
  "name": "Inventory (example)",
  "description": "A complete, minimal example manifest showing every field an extension module can declare. Disabled by default so it never appears in a real workspace unless a self-hoster turns it on.",
  "category": "delivery",
  "defaultEnabled": false,
  "navLinks": [
    {
      "id": "example-inventory",
      "label": "Inventory",
      "href": "/admin/example-inventory",
      "icon": "Library",
      "description": "Stock levels and reorder points",
      "moreGroup": "Delivery"
    }
  ],
  "routes": ["/admin/example-inventory"],
  "aiToolNames": [],
  "setupChecks": [],
  "docsUrl": "https://github.com/JohnConnorCode/accelerate-site/blob/main/plugins/example-inventory/README.md",
  "settings": [
    {
      "key": "reorderThreshold",
      "label": "Reorder threshold",
      "description": "Flag an item as low stock once its quantity falls to or below this number.",
      "type": "number",
      "default": 10,
      "min": 0,
      "max": 10000
    },
    {
      "key": "defaultWarehouse",
      "label": "Default warehouse",
      "description": "Where a newly received item is assumed to be stored.",
      "type": "enum",
      "options": ["main", "overflow"],
      "default": "main"
    },
    {
      "key": "autoReorderEnabled",
      "label": "Propose reorders automatically",
      "description": "When on, low-stock items get a reorder task proposed for approval instead of waiting to be noticed.",
      "type": "boolean",
      "default": false
    }
  ]
}
